{"_nota":"Muestra de 60 s de data/m001/positions.json, de 62:30 a 63:30: el desmarque de Torres que arrastra a Cárdenas, el pase de Salgado y el gol de Ramírez. Se genera con python -m baja_insights positions; el archivo completo tiene los 90 minutos.","match_id":"m001","illustrative":true,"hz":2,"coordinates":"metres on 105 x 68, origin bottom left, home attacks x = 105 in both halves, as the events","periods":[{"period":1,"from_t_s":0,"to_t_s":2700,"home_attacks":"right","rotate_180":false},{"period":2,"from_t_s":2700,"to_t_s":5400,"home_attacks":"left","rotate_180":true}],"teams":{"home":{"name":"Bahía FC","players":[{"slot":0,"player":"L. Arce","number":1,"position":"POR"},{"slot":1,"player":"D. Mena","number":2,"position":"LD"},{"slot":2,"player":"S. Beltrán","number":5,"position":"DFC"},{"slot":3,"player":"E. Quiroz","number":4,"position":"DFC"},{"slot":4,"player":"P. Lugo","number":3,"position":"LI"},{"slot":5,"player":"F. Cota","number":6,"position":"MCD"},{"slot":6,"player":"O. Félix","number":14,"position":"MC"},{"slot":7,"player":"R. Salgado","number":8,"position":"MC"},{"slot":8,"player":"J. Torres","number":7,"position":"ED"},{"slot":9,"player":"A. Olvera","number":11,"position":"EI"},{"slot":10,"player":"M. Ramírez","number":9,"position":"DC"}]},"away":{"name":"Real Cardón","players":[{"slot":0,"player":"H. Zamora","number":1,"position":"POR"},{"slot":1,"player":"N. Ruelas","number":2,"position":"LD"},{"slot":2,"player":"T. Esquer","number":5,"position":"DFC"},{"slot":3,"player":"G. Cárdenas","number":4,"position":"DFC"},{"slot":4,"player":"B. Haro","number":3,"position":"LI"},{"slot":5,"player":"V. Meza","number":6,"position":"MCD"},{"slot":6,"player":"E. Sandoval","number":10,"position":"MC"},{"slot":7,"player":"K. Rosas","number":8,"position":"MC"},{"slot":8,"player":"L. Montaño","number":7,"position":"ED"},{"slot":9,"player":"D. Verdugo","number":11,"position":"EI"},{"slot":10,"player":"S. Leyva","number":9,"position":"DC"}]}},"lineup_changes":[{"t_s":4200,"team":"away","slot":8,"player_out":"L. Montaño","player_in":"R. Amador","number":17,"position":"ED"},{"t_s":4860,"team":"home","slot":10,"player_out":"M. Ramírez","player_in":"C. Ibarra","number":19,"position":"DC"}],"set_pieces":[{"t_s":3830.0,"kind":"kickoff","team":"away","taker":"S. Leyva","spot":[52.5,34.0],"ball_out_from_t_s":3790.0}],"frames":[{"t":3750.0,"b":[74.0,56.0],"h":[[10.5,38.4],[51.8,12.5],[39.8,47.0],[39.8,29.8],[51.8,64.3],[55.8,38.4],[69.8,49.2],[69.8,27.6],[89.8,12.5],[89.8,64.3],[95.6,38.4]],"a":[[99.7,38.4],[85.7,60.2],[95.1,35.8],[95.1,48.0],[85.7,23.7],[82.6,41.9],[71.7,34.3],[71.7,49.5],[56.1,60.2],[56.1,23.7],[46.7,41.9]]},{"t":3750.5,"b":[74.0,56.0],"h":[[10.5,38.4],[51.8,12.5],[39.8,47.0],[39.8,29.8],[51.8,64.3],[55.8,38.4],[69.8,49.2],[69.8,27.6],[89.8,12.5],[89.8,64.3],[95.6,38.4]],"a":[[99.7,38.4],[85.7,60.2],[95.1,35.8],[95.1,48.0],[85.7,23.7],[82.6,41.9],[71.7,34.3],[71.7,49.5],[56.1,60.2],[56.1,23.7],[46.7,41.9]]},{"t":3751.0,"b":[74.0,56.0],"h":[[10.5,38.4],[51.8,12.5],[39.8,47.0],[39.8,29.8],[51.8,64.3],[55.8,38.4],[69.8,49.2],[69.8,27.6],[89.8,12.5],[89.8,64.3],[95.6,38.4]],"a":[[99.7,38.4],[85.7,60.2],[95.1,35.8],[95.1,48.0],[85.7,23.7],[82.6,41.9],[71.7,34.3],[71.7,49.5],[56.1,60.2],[56.1,23.7],[46.7,41.9]]},{"t":3751.5,"b":[74.0,56.0],"h":[[10.5,38.4],[51.8,12.5],[39.8,47.0],[39.8,29.8],[51.8,64.3],[55.8,38.4],[69.8,49.2],[69.8,27.6],[89.8,12.5],[89.8,64.3],[95.6,38.4]],"a":[[99.7,38.4],[85.7,60.2],[95.1,35.8],[95.1,48.0],[85.7,23.7],[82.6,41.9],[71.7,34.3],[71.7,49.5],[56.1,60.2],[56.1,23.7],[46.7,41.9]]},{"t":3752.0,"b":[74.0,56.0],"h":[[10.5,38.4],[51.8,12.5],[39.8,47.0],[39.8,29.8],[51.8,64.3],[55.8,38.4],[69.8,49.2],[69.8,27.6],[89.8,12.5],[89.8,64.3],[95.6,38.4]],"a":[[99.7,38.4],[85.7,60.2],[95.1,35.8],[95.1,48.0],[85.7,23.7],[82.6,41.9],[71.7,34.3],[71.7,49.5],[56.1,60.2],[56.1,23.7],[46.7,41.9]]},{"t":3752.5,"b":[74.0,56.0],"h":[[10.5,38.4],[51.8,12.5],[39.8,47.0],[39.8,29.8],[51.8,64.3],[55.8,38.4],[69.8,49.2],[69.8,27.6],[89.8,12.5],[89.8,64.3],[95.6,38.4]],"a":[[99.7,38.4],[85.7,60.2],[95.1,35.8],[95.1,48.0],[85.7,23.7],[82.6,41.9],[71.7,34.3],[71.7,49.5],[56.1,60.2],[56.1,23.7],[46.7,41.9]]},{"t":3753.0,"b":[74.0,56.0],"h":[[10.5,38.4],[51.8,12.5],[39.8,47.0],[39.8,29.8],[51.8,64.3],[55.8,38.4],[69.8,49.2],[69.8,27.6],[89.8,12.5],[89.8,64.3],[95.6,38.4]],"a":[[99.7,38.4],[85.7,60.2],[95.1,35.8],[95.1,48.0],[85.7,23.7],[82.6,41.9],[71.7,34.3],[71.7,49.5],[56.1,60.2],[56.1,23.7],[46.7,41.9]]},{"t":3753.5,"b":[74.0,56.0],"h":[[10.5,38.4],[51.8,12.5],[39.8,47.0],[39.8,29.8],[51.8,64.3],[55.8,38.4],[69.8,49.2],[69.8,27.6],[89.8,12.5],[89.8,64.3],[95.6,38.4]],"a":[[99.7,38.4],[85.7,60.2],[95.1,35.8],[95.1,48.0],[85.7,23.7],[82.6,41.9],[71.7,34.3],[71.7,49.5],[56.1,60.2],[56.1,23.7],[46.7,41.9]]},{"t":3754.0,"b":[74.0,56.0],"h":[[10.5,38.4],[51.8,12.5],[39.8,47.0],[39.8,29.8],[51.8,64.3],[55.8,38.4],[69.8,49.2],[69.8,27.6],[89.8,12.5],[89.8,64.3],[95.6,38.4]],"a":[[99.7,38.4],[85.7,60.2],[95.1,35.8],[95.1,48.0],[85.7,23.7],[82.6,41.9],[71.7,34.3],[71.7,49.5],[56.1,60.2],[56.1,23.7],[46.7,41.9]]},{"t":3754.5,"b":[74.0,56.0],"h":[[10.5,38.4],[51.8,12.5],[39.8,47.0],[39.8,29.8],[51.8,64.3],[55.8,38.4],[69.8,49.2],[69.8,27.6],[89.8,12.5],[89.8,64.3],[95.6,38.4]],"a":[[99.7,38.4],[85.7,60.2],[95.1,35.8],[95.1,48.0],[85.7,23.7],[82.6,41.9],[71.7,34.3],[71.7,49.5],[56.1,60.2],[56.1,23.7],[46.7,41.9]]},{"t":3755.0,"b":[74.0,56.0],"h":[[10.5,38.4],[51.8,12.5],[39.8,47.0],[39.8,29.8],[51.8,64.3],[55.8,38.4],[69.8,49.2],[69.8,27.6],[89.8,12.5],[89.8,64.3],[95.6,38.4]],"a":[[99.7,38.4],[85.7,60.2],[95.1,35.8],[95.1,48.0],[85.7,23.7],[82.6,41.9],[71.7,34.3],[71.7,49.5],[56.1,60.2],[56.1,23.7],[46.7,41.9]]},{"t":3755.5,"b":[74.0,56.0],"h":[[10.5,38.4],[51.8,12.5],[39.8,47.0],[39.8,29.8],[51.8,64.3],[55.8,38.4],[69.8,49.2],[69.8,27.6],[89.8,12.5],[89.8,64.3],[95.6,38.4]],"a":[[99.7,38.4],[85.7,60.2],[95.1,35.8],[95.1,48.0],[85.7,23.7],[82.6,41.9],[71.7,34.3],[71.7,49.5],[56.1,60.2],[56.1,23.7],[46.7,41.9]]},{"t":3756.0,"b":[74.0,56.0],"h":[[10.5,38.4],[51.8,12.5],[39.8,47.0],[39.8,29.8],[51.8,64.3],[55.8,38.4],[69.8,49.2],[69.8,27.6],[89.8,12.5],[89.8,64.3],[95.6,38.4]],"a":[[99.7,38.4],[85.7,60.2],[95.1,35.8],[95.1,48.0],[85.7,23.7],[82.6,41.9],[71.7,34.3],[71.7,49.5],[56.1,60.2],[56.1,23.7],[46.7,41.9]]},{"t":3756.5,"b":[74.0,56.0],"h":[[10.5,38.4],[51.8,12.5],[39.8,47.0],[39.8,29.8],[51.8,64.3],[55.8,38.4],[69.8,49.2],[69.8,27.6],[89.8,12.5],[89.8,64.3],[95.6,38.4]],"a":[[99.7,38.4],[85.7,60.2],[95.1,35.8],[95.1,48.0],[85.7,23.7],[82.6,41.9],[71.7,34.3],[71.7,49.5],[56.1,60.2],[56.1,23.7],[46.7,41.9]]},{"t":3757.0,"b":[74.0,56.0],"h":[[10.5,38.4],[51.8,12.5],[39.8,47.0],[39.8,29.8],[51.8,64.3],[55.8,38.4],[69.8,49.2],[69.8,27.6],[89.8,12.5],[89.8,64.3],[95.6,38.4]],"a":[[99.7,38.4],[85.7,60.2],[95.1,35.8],[95.1,48.0],[85.7,23.7],[82.6,41.9],[71.7,34.3],[71.7,49.5],[56.1,60.2],[56.1,23.7],[46.7,41.9]]},{"t":3757.5,"b":[74.0,56.0],"h":[[10.5,38.4],[51.8,12.5],[39.8,47.0],[39.8,29.8],[51.8,64.3],[55.8,38.4],[69.8,49.2],[69.8,27.6],[89.8,12.5],[89.8,64.3],[95.6,38.4]],"a":[[99.7,38.4],[85.7,60.2],[95.1,35.8],[95.1,48.0],[85.7,23.7],[82.6,41.9],[71.7,34.3],[71.7,49.5],[56.1,60.2],[56.1,23.7],[46.7,41.9]]},{"t":3758.0,"b":[74.0,56.0],"h":[[10.5,38.4],[51.8,12.5],[39.8,47.0],[39.8,29.8],[51.8,64.3],[55.8,38.4],[69.8,49.2],[69.8,27.6],[89.8,12.5],[89.8,64.3],[95.6,38.4]],"a":[[99.7,38.4],[85.7,60.2],[95.1,35.8],[95.1,48.0],[85.7,23.7],[82.6,41.9],[71.7,34.3],[71.7,49.5],[56.1,60.2],[56.1,23.7],[46.7,41.9]]},{"t":3758.5,"b":[74.0,56.0],"h":[[10.5,38.4],[51.8,12.5],[39.8,47.0],[39.8,29.8],[51.8,64.3],[55.8,38.4],[69.8,49.2],[69.8,27.6],[89.8,12.5],[89.8,64.3],[95.6,38.4]],"a":[[99.7,38.4],[85.7,60.2],[95.1,35.8],[95.1,48.0],[85.7,23.7],[82.6,41.9],[71.7,34.3],[71.7,49.5],[56.1,60.2],[56.1,23.7],[46.7,41.9]]},{"t":3759.0,"b":[74.0,56.0],"h":[[10.5,38.4],[51.8,12.5],[39.8,47.0],[39.8,29.8],[51.8,64.3],[55.8,38.4],[69.8,49.2],[69.8,27.6],[89.8,12.5],[89.8,64.3],[95.6,38.4]],"a":[[99.7,38.4],[85.7,60.2],[95.1,35.8],[95.1,48.0],[85.7,23.7],[82.6,41.9],[71.7,34.3],[71.7,49.5],[56.1,60.2],[56.1,23.7],[46.7,41.9]]},{"t":3759.5,"b":[74.0,56.0],"h":[[10.5,38.4],[51.8,12.5],[39.8,47.0],[39.8,29.8],[51.8,64.3],[55.8,38.4],[69.8,49.2],[69.8,27.6],[89.8,12.5],[89.8,64.3],[95.6,38.4]],"a":[[99.7,38.4],[85.7,60.2],[95.1,35.8],[95.1,48.0],[85.7,23.7],[82.6,41.9],[71.7,34.3],[71.7,49.5],[56.1,60.2],[56.1,23.7],[46.7,41.9]]},{"t":3760.0,"b":[74.0,56.0],"h":[[10.5,38.4],[51.8,12.5],[39.8,47.0],[39.8,29.8],[51.8,64.3],[55.8,38.4],[69.8,49.2],[69.8,27.6],[89.8,12.5],[89.8,64.3],[95.6,38.4]],"a":[[99.7,38.4],[85.7,60.2],[95.1,35.8],[95.1,48.0],[85.7,23.7],[82.6,41.9],[71.7,34.3],[71.7,49.5],[56.1,60.2],[56.1,23.7],[46.7,41.9]]},{"t":3760.5,"b":[74.0,56.0],"h":[[10.5,38.4],[51.8,12.5],[39.8,47.0],[39.8,29.8],[51.8,64.3],[55.8,38.4],[69.8,49.2],[69.8,27.6],[89.8,12.5],[89.8,64.3],[95.6,38.4]],"a":[[99.7,38.4],[85.7,60.2],[95.1,35.8],[95.1,48.0],[85.7,23.7],[82.6,41.9],[71.7,34.3],[71.7,49.5],[56.1,60.2],[56.1,23.7],[46.7,41.9]]},{"t":3761.0,"b":[74.0,56.0],"h":[[10.5,38.4],[51.8,12.5],[39.8,47.0],[39.8,29.8],[51.8,64.3],[55.8,38.4],[69.8,49.2],[69.8,27.6],[89.8,12.5],[89.8,64.3],[95.6,38.4]],"a":[[99.7,38.4],[85.7,60.2],[95.1,35.8],[95.1,48.0],[85.7,23.7],[82.6,41.9],[71.7,34.3],[71.7,49.5],[56.1,60.2],[56.1,23.7],[46.7,41.9]]},{"t":3761.5,"b":[74.0,56.0],"h":[[10.5,38.4],[51.8,12.5],[39.8,47.0],[39.8,29.8],[51.8,64.3],[55.8,38.4],[69.8,49.2],[69.8,27.6],[89.8,12.5],[89.8,64.3],[95.6,38.4]],"a":[[99.7,38.4],[85.7,60.2],[95.1,35.8],[95.1,48.0],[85.7,23.7],[82.6,41.9],[71.7,34.3],[71.7,49.5],[56.1,60.2],[56.1,23.7],[46.7,41.9]]},{"t":3762.0,"b":[74.0,56.0],"h":[[10.5,38.4],[51.8,12.5],[39.8,47.0],[39.8,29.8],[51.8,64.3],[55.8,38.4],[69.8,49.2],[69.8,27.6],[89.8,12.5],[89.8,64.3],[95.6,38.4]],"a":[[99.7,38.4],[85.7,60.2],[95.1,35.8],[95.1,48.0],[85.7,23.7],[82.6,41.9],[71.7,34.3],[71.7,49.5],[56.1,60.2],[56.1,23.7],[46.7,41.9]]},{"t":3762.5,